{
  "schema": "gprMax-material-database",
  "schema_version": 1,
  "database": {
    "id": "partial_volume_materials",
    "name": "Materials for geometry object partial_volume.h5",
    "version": "1.0.0",
    "description": "Generated by #geometry_objects_write; material keys match /material_keys in the HDF5 file."
  },
  "materials": {
    "material_000_free_space": {
      "name": "free_space",
      "model": "constant",
      "base": {
        "relative_permittivity": 1.0,
        "electric_conductivity_s_per_m": 0.0,
        "relative_permeability": 1.0,
        "magnetic_conductivity_s_per_m": 0.0
      },
      "averagable": true,
      "metadata": {
        "original_id": "free_space"
      }
    },
    "material_001_myWater": {
      "name": "myWater",
      "model": "constant",
      "base": {
        "relative_permittivity": 4.9,
        "electric_conductivity_s_per_m": 0.0,
        "relative_permeability": 1.0,
        "magnetic_conductivity_s_per_m": 0.0
      },
      "averagable": true,
      "metadata": {
        "original_id": "myWater"
      }
    },
    "material_002_boxMaterial": {
      "name": "boxMaterial",
      "model": "constant",
      "base": {
        "relative_permittivity": 3.0,
        "electric_conductivity_s_per_m": 0.0,
        "relative_permeability": 2.0,
        "magnetic_conductivity_s_per_m": 0.0
      },
      "averagable": true,
      "metadata": {
        "original_id": "boxMaterial"
      }
    },
    "material_003_Hmag_boxMaterial_boxMaterial_free_space_free_space": {
      "name": "Hmag_boxMaterial+boxMaterial+free_space+free_space",
      "model": "constant",
      "base": {
        "relative_permittivity": 2.0,
        "electric_conductivity_s_per_m": 0.0,
        "relative_permeability": 1.3333333333333333,
        "magnetic_conductivity_s_per_m": 0.0
      },
      "averagable": true,
      "metadata": {
        "original_id": "Hmag_boxMaterial+boxMaterial+free_space+free_space"
      }
    },
    "material_004_Hmag_free_space_free_space_myWater_myWater": {
      "name": "Hmag_free_space+free_space+myWater+myWater",
      "model": "constant",
      "base": {
        "relative_permittivity": 2.95,
        "electric_conductivity_s_per_m": 0.0,
        "relative_permeability": 1.0,
        "magnetic_conductivity_s_per_m": 0.0
      },
      "averagable": true,
      "metadata": {
        "original_id": "Hmag_free_space+free_space+myWater+myWater"
      }
    },
    "material_005_boxMaterial_boxMaterial_free_space_free_space": {
      "name": "boxMaterial+boxMaterial+free_space+free_space",
      "model": "constant",
      "base": {
        "relative_permittivity": 2.0,
        "electric_conductivity_s_per_m": 0.0,
        "relative_permeability": 1.5,
        "magnetic_conductivity_s_per_m": 0.0
      },
      "averagable": true,
      "metadata": {
        "original_id": "boxMaterial+boxMaterial+free_space+free_space"
      }
    },
    "material_006_boxMaterial_free_space_free_space_free_space": {
      "name": "boxMaterial+free_space+free_space+free_space",
      "model": "constant",
      "base": {
        "relative_permittivity": 1.5,
        "electric_conductivity_s_per_m": 0.0,
        "relative_permeability": 1.25,
        "magnetic_conductivity_s_per_m": 0.0
      },
      "averagable": true,
      "metadata": {
        "original_id": "boxMaterial+free_space+free_space+free_space"
      }
    },
    "material_007_free_space_free_space_free_space_myWater": {
      "name": "free_space+free_space+free_space+myWater",
      "model": "constant",
      "base": {
        "relative_permittivity": 1.975,
        "electric_conductivity_s_per_m": 0.0,
        "relative_permeability": 1.0,
        "magnetic_conductivity_s_per_m": 0.0
      },
      "averagable": true,
      "metadata": {
        "original_id": "free_space+free_space+free_space+myWater"
      }
    },
    "material_008_free_space_free_space_myWater_myWater": {
      "name": "free_space+free_space+myWater+myWater",
      "model": "constant",
      "base": {
        "relative_permittivity": 2.95,
        "electric_conductivity_s_per_m": 0.0,
        "relative_permeability": 1.0,
        "magnetic_conductivity_s_per_m": 0.0
      },
      "averagable": true,
      "metadata": {
        "original_id": "free_space+free_space+myWater+myWater"
      }
    },
    "material_009_free_space_myWater_myWater_myWater": {
      "name": "free_space+myWater+myWater+myWater",
      "model": "constant",
      "base": {
        "relative_permittivity": 3.9250000000000003,
        "electric_conductivity_s_per_m": 0.0,
        "relative_permeability": 1.0,
        "magnetic_conductivity_s_per_m": 0.0
      },
      "averagable": true,
      "metadata": {
        "original_id": "free_space+myWater+myWater+myWater"
      }
    }
  }
}
