{
  "schema": "gprMax-material-database",
  "schema_version": 1,
  "database": {
    "id": "antenna",
    "name": "Antenna and microwave materials",
    "version": "1.0.0",
    "description": "Reserved for curated antenna material models with traceable sources and validity metadata.",
    "licence": "GPL-3.0-or-later"
  },
  "materials": {}
}
