{
  "schema": "gprMax-material-database",
  "schema_version": 1,
  "database": {
    "id": "PMN_materials",
    "name": "PMN materials",
    "version": "1.0.0"
  },
  "materials": {
    "pec": {
      "model": "constant",
      "base": {
        "relative_permittivity": 1.0,
        "electric_conductivity_s_per_m": "inf",
        "relative_permeability": 1.0,
        "magnetic_conductivity_s_per_m": 0.0
      }
    },
    "freespace": {
      "model": "constant",
      "base": {
        "relative_permittivity": 1.0,
        "electric_conductivity_s_per_m": 0.0,
        "relative_permeability": 1.0,
        "magnetic_conductivity_s_per_m": 0.0
      }
    },
    "plastic": {
      "model": "constant",
      "base": {
        "relative_permittivity": 3.0,
        "electric_conductivity_s_per_m": 0.0,
        "relative_permeability": 1.0,
        "magnetic_conductivity_s_per_m": 0.0
      }
    },
    "bakelite": {
      "model": "constant",
      "base": {
        "relative_permittivity": 3.5,
        "electric_conductivity_s_per_m": 0.0,
        "relative_permeability": 1.0,
        "magnetic_conductivity_s_per_m": 0.0
      }
    },
    "rubber": {
      "model": "constant",
      "base": {
        "relative_permittivity": 6.0,
        "electric_conductivity_s_per_m": 0.0,
        "relative_permeability": 1.0,
        "magnetic_conductivity_s_per_m": 0.0
      }
    }
  }
}
