{
  "schema": "gprMax-material-database",
  "schema_version": 1,
  "database": {
    "id": "TS50_materials",
    "name": "TS50 materials",
    "version": "1.0.0"
  },
  "materials": {
    "pec": {
      "model": "constant",
      "base": {
        "relative_permittivity": 1.0,
        "electric_conductivity_s_per_m": "inf",
        "relative_permeability": 1.0,
        "magnetic_conductivity_s_per_m": 0.0
      }
    },
    "freespace": {
      "model": "constant",
      "base": {
        "relative_permittivity": 1.0,
        "electric_conductivity_s_per_m": 0.0,
        "relative_permeability": 1.0,
        "magnetic_conductivity_s_per_m": 0.0
      }
    },
    "mat25": {
      "model": "constant",
      "base": {
        "relative_permittivity": 2.5,
        "electric_conductivity_s_per_m": 0.0,
        "relative_permeability": 1.0,
        "magnetic_conductivity_s_per_m": 0.0
      }
    },
    "mat3": {
      "model": "constant",
      "base": {
        "relative_permittivity": 3.0,
        "electric_conductivity_s_per_m": 0.0,
        "relative_permeability": 1.0,
        "magnetic_conductivity_s_per_m": 0.0
      }
    },
    "mat4": {
      "model": "constant",
      "base": {
        "relative_permittivity": 4.0,
        "electric_conductivity_s_per_m": 0.0,
        "relative_permeability": 1.0,
        "magnetic_conductivity_s_per_m": 0.0
      }
    },
    "mat5": {
      "model": "constant",
      "base": {
        "relative_permittivity": 5.0,
        "electric_conductivity_s_per_m": 0.0,
        "relative_permeability": 1.0,
        "magnetic_conductivity_s_per_m": 0.0
      }
    }
  }
}
