{
  "schema": "gprMax-material-database",
  "schema_version": 1,
  "database": {
    "id": "can_materials",
    "name": "can materials",
    "version": "1.0.0"
  },
  "materials": {
    "pec": {
      "model": "constant",
      "base": {
        "relative_permittivity": 1.0,
        "electric_conductivity_s_per_m": "inf",
        "relative_permeability": 1.0,
        "magnetic_conductivity_s_per_m": 0.0
      }
    }
  }
}
